"CONTA_CONTABIL";"DESCRICAO";"ORIENTACOES"
"1.02.05.01.28";"Outros Intangiveis";"Contas que registram os custos com aquisicao de outros itens classificaveis no intangivel. Nos termos do CPC04, ativo intangivel e um ativo nao monetario identificavel sem substancia fisica, ou seja, regra geral, para registra-los no ativo necessario que sejam  identificaveis, controlados e geradores de beneficios economicos futuros. Conforme itens 63/64, CPC04, os gastos incorridos com marcas, titulos de publicacao, lista de clientes e outros itens similares, quando gerados internamente, nao devem ser reconhecidos como ativos intangiveis. Apos o seu reconhecimento inicial, um ativo intangivel deve ser apresentado ao custo, menos a eventual amortizacao acumulada e a perda acumulada do valor recuperavel. Em se definindo sua vida util, este bem deve ser amortizado por este prazo, o mesmo nao ocorrendo para aqueles com vida util indefinida, ou seja, com base na analise de todos os fatores relevantes, nao existe um limite previsivel para o periodo durante o qual o ativo devera gerar fluxos de caixa liquidos positivos para a pessoa juridica.Conforme itens 54/56, CPC04, os gastos com pesquisa devem ser reconhecidos como despesa, enquando os despendidos no desenvolvimento devem ser ativados, itens 57/59."
"1.02.05.01.29";"(-) Outras Contas Redutoras do Intangivel";"Outras contas redutoras do intangivel, nao classificaveis em outras contas especificas. "
"1.02.05.01.55";"(-) Perdas por Reducao ao Valor Recuperavel (Impairment) - Intangivel";"Contas que registram as perdas estimadas com base em evidencias objetivas  que demonstrem a nao recuperabilidade do valor contabil do ativo intangivel. Esta conta tambem registra as eventuais reversoes. Referidos valores deverao ser adicionados ao Lucro Real, mantidos na Parte B do eLalur ate ocorrencia da alienacao ou baixa do ativo, quando poderao ser excluidos do Lucro Real(art. 32, Lei no 12.973/2014)."
"1.02.05.01.56";"(-) Perdas por Reducao ao Valor Recuperavel (Impairment) do Goodwill-Intangivel";"Contas que registram as perdas estimadas com base em evidencias objetivas  que demonstrem a nao recuperabilidade do valor contabil do goodwill, exceto resultante de aquisicao de participacao societaria, cujas perdas por desvalorizacao estao registrados nas contas 1.02.02.01.56 e 1.02.02.02.56.  Estes valores nao estao sujeitos a reversao, conforme item 124, CPC 01. Referidos valores deverao ser adicionados ao Lucro Real, mantidos na Parte B do eLalur ate ocorrencia da alienacao ou baixa do ativo, quando poderao ser excluidos do Lucro Real(art. 28, Lei no 12.973/2014)."
"1.02.05.01.75";"(-) Subconta-Ajuste a Valor Presente (AVP)-Intangivel";"Contas que registram contrapartidas dos ajustes a valor presente efetuados sobre os passivos decorrentes de compras a prazo de intangiveis. Referidos valores serao apropriados ao resultado pelo regime de competencia e adicionados ao Lucro Real. Concomitante controle ocorrera nesta subconta ate que bem seja realizado, quando valor do AVP podera ser excluido do Lucro Real do periodo(art.5o, Lei 12.973/2014). Detalhes sobre a contabilizacao estao descritos no Anexo I, exemplo 4,  Instrucao Normativa SRF no 1.515/2014). Apenas no caso da conta contabil que registra o ativo consolidar varios itens de mesma natureza, pode-se  utilizar uma mesma subconta coletiva, desde que demonstre-os em razao auxiliar vinculado a ECD(art. 33, ?3o, Instrucao Normativa SRF no 1.515/2014)"
"1.02.05.01.77";"Subconta-Ajuste Valor Presente-Amortizacao Acumulada-Intangivel";"Contas que registram a amortizacao acumulada sobre o ajuste a  valor presente registrado na subconta 1.02.05.01.75. A operacionalizacao desta subconta esta evidenciada no exemplo 4, anexo I, da Instrucao Normativa SRF no 1.515/2014"
"1.02.05.01.90";"Subconta-Adocao Inicial-Intangivel";"Contas que registram as diferencas positivas ou negativas, na data da adocao dos efeitos da Lei no 12.973/2014, entre o valor do ativo mensurado de acordo as disposicoes da Lei no 6.404/1976 e o valor mensurado pelos metodos e criterios vigentes em 31/12/2007(arts. 66/67, Lei no 12.973/2014). Referidos valores  deverao ser computados na apuracao  Lucro Real a medida da realizacao do bem, (arts. 164 e 167,  Instrucao Normativa SRF no 1.515/2014, cujos detalhes sobre a contabilizacao estao descritos em seu Anexo I,  exemplos 1/2). Conforme disciplinado art. 169, ? 9a, Instrucao Normativa SRF no 1.515/2014, cada subconta de adocao inicial deve registrar individualmente a diferenca de valor identificada em cada ativo.  Apenas no caso da conta contabil que registra o ativo consolidar varios itens de mesma natureza, pode-se  utilizar uma mesma subconta coletiva, desde que demonstre-os em razao auxiliar vinculado a ECD(art. 169, ?6o, Instrucao Normativa SRF no 1.515/2014). No caso do ativo nao estar reconhecido no FCONT, apenas na contabilidade societaria, fica dispensada a constituicao da subconta de adocao inicial, nos termos do art. 169, ?3o, Instrucao Normativa SRF no 1.515/2014)"
"1.02.05.01.92";"Subconta-Adocao Inicial-Amortizacao Acumulada-Intangivel";"Contas que registram a amortizacao acumulada sobre o ajuste adocao inicial registrado na subconta 1.02.05.01.90. A operacionalizacao desta subconta esta evidenciada nos exemplos 1/2, anexo I, da Instrucao Normativa SRF no 1.515/2014"
"1.02.06";"DIFERIDO";
"1.02.06.01";"ATIVO DIFERIDO";
"1.02.06.01.01";"Despesas Pre-Operacionais ou Pre-Industriais-Ativo Diferido";"Contas que registram os gastos de organizacao e administracao, encargos financeiros liquidos, estudos, projetos e detalhamentos, juros a acionista na fase de implantacao e gastos preliminares de operacao. O saldo existente em 31 de dezembro de 2008 no ativo diferido que, pela sua natureza, nao puder ser alocado a outro grupo de contas, podera permanecer no ativo sob essa classificacao ate sua completa amortizacao, sujeito a analise sobre a recuperacao."
"1.02.06.01.02";"Despesas com Pesquisas Cientificas ou Tecnologicas-Ativo Diferido";"Contas que registram os gastos com pesquisa cientifica ou tecnologica. O saldo existente em 31 de dezembro de 2008 no ativo diferido que, pela sua natureza, nao puder ser alocado a outro grupo de contas, podera permanecer no ativo sob essa classificacao ate sua completa amortizacao, sujeito a analise sobre a recuperacao."
"1.02.06.01.03";"Demais Aplicacoes em Despesas Amortizaveis-Ativo Diferido";"Contas que registram os gastos com pesquisas e desenvolvimento de produtos, com a implantacao de sistemas e metodos e com reorganizacao. O saldo existente em 31 de dezembro de 2008 no ativo diferido que, pela sua natureza, nao puder ser alocado a outro grupo de contas, podera permanecer no ativo sob essa classificacao ate sua completa amortizacao, sujeito a analise sobre a recuperacao."
"1.02.06.01.31";"(-) Amortizacao Acumulada-Ativo Diferido";"Contas que registram a amortizacao das contas do ativo diferido."
"1.02.06.01.56";"(-) Perdas por Reducao ao Valor Recuperavel (Impairment)- Ativo Diferido";"Contas que registram as perdas estimadas com base em evidencias objetivas  que demonstrem a nao recuperabilidade do valor contabil do ativo diferido. Esta conta tambem registra as eventuais reversoes."
"1.02.06.01.90";"Subconta-Adocao Inicial-Ativo Diferido";"Contas que registram as diferencas positivas ou negativas, na data da adocao dos efeitos da Lei no 12.973/2014, entre o valor do ativo mensurado de acordo as disposicoes da Lei no 6.404/1976 e o valor mensurado pelos metodos e criterios vigentes em 31/12/2007(arts. 66/67, Lei no 12.973/2014). Conforme disciplinado art. 169, ? 9a, Instrucao Normativa SRF no 1.515/2014, cada subconta de adocao inicial deve registrar individualmente a diferenca de valor identificada em cada ativo.  Apenas no caso da conta contabil que registra o ativo consolidar varios itens de mesma natureza, pode-se  utilizar uma mesma subconta coletiva, desde que demonstre-os em razao auxiliar vinculado a ECD(art. 169, ?6o, Instrucao Normativa SRF no 1.515/2014). No caso de ativo diferido existente apenas no FCONT, nao havera registro em subcontas, devendo tal valor ser controlado na parte B do eLalur(art. 171, ?1o, Instrucao Normativa SRF no 1.515/2014). No caso do ativo nao estar reconhecido na contabilidade societaria, apenas no FCONT, a diferenca em questao devera ser controlada na parte B do eLalur,  nos termos do art. 171, ?1o, Instrucao Normativa SRF no 1.515/2014)"
"2";"PASSIVO";
"2.01";"PASSIVO CIRCULANTE";
"2.01.01";"OBRIGACOES DO CIRCULANTE";
"2.01.01.01";"BENEFICIOS E ENCARGOS SOCIAIS-CIRCULANTE";
"2.01.01.01.01";"Salarios e Remuneracoes a Pagar";"Contas que registram o valor correspondente aos salarios, ordenados, pro labore, horas extras, , adicionais e premios a serem pagos no exercicio subsequente, inclusive gratificacoes a empregados, o valor das ferias do periodo aquisitivo ja completo, 13 salarios a pagar."
"2.01.01.01.02";"Participacoes no Resultado a Pagar";"Contas que registram o valor correspondente a participacao no resultado a serem pagos no exercicio subsequente de administradores e empregados."
"2.01.01.01.03";"INSS a Recolher";"Contas que registram o valor das Contribuicoes Previdenciarias a recolher."
"2.01.01.01.04";"FGTS a Recolher";"Contas que registram o valor do FGTS a recolher."
"2.01.01.01.05";"Beneficios Nao Monetarios";"Contas que registram os beneficios nao monetarios a pagar. Nos termos do item 9(d), CPC 33(R1), beneficios de curto prazo tais como assistencia medica, moradia, carros e bens ou servicos gratuitos ou subsidiados para os atuais empregados ou administradores."
"2.01.01.01.50";"Beneficios Pos-Emprego";"Contas que registram os beneficios pos-emprego a pagar. Nos termos do item 26, CPC 33(R1), aqueles pagos apos o periodo de emprego, tais como aposentadoria, pensoes, seguro de via e assistencia medica pos-emprego."
"2.01.01.01.55";"Outros Beneficios de Longo Prazo";"Contas que registram outros beneficios de longo prazo a pagar no curto prazo. Nos termos do item 5(c), CPC 33(R1), sao aqueles que nao se espera  sejam integralmente liquidados em ate doze meses apos o fim do exercicio em que os empregados prestarem o respectivo servico, tais como ausencias remuneradas de longo prazo, licencas por tempo de servico, jubileu , beneficios por invalidez de longo prazo."
"2.01.01.01.60";"Beneficios Rescisorios";"Contas que registram os beneficios rescisorios a pagar. Nos termos do item 8, CPC 33(R1), sao aqueles fornecidos pela rescisao do contrato de trabalho de empregado, seja decisao da pessoa juridica de terminar o vinculo empregaticio do empregado antes da data normal da aposentadoria, seja decisao do empregado de aceitar uma oferta de beneficios em troca da rescisao do contrato de trabalho."
"2.01.01.01.09";"Demais Encargos a Recolher";"Contas correspondentes a outros encargos a recolher incidentes sobre a folha de pagamentos dos funcionarios, exceto INSS e FGTS."
"2.01.01.03";"FORNECEDORES-CIRCULANTE";
"2.01.01.03.01";"Fornecedores-Operacoes com Partes Nao Relacionadas-No Pais-Circulante";"Contas que registram o valor a pagar correspondentes a compra de bens, direitos e servicos de fornecedores nacionais, nao relacionados com declarante, conforme conceito definido no CPC 05(R1), itens 09 a 12"
"2.01.01.03.02";"Fornecedores-Operacoes com Partes Nao Relacionadas-No Exterior-Circulante";"Contas que registram o valor a pagar correspondentes a compra de de bens, direitos e servicos de fornecedores estrangeiros, nao relacionados com declarante, conforme conceito definido no CPC 05(R1), itens 09 a 12"
"2.01.01.03.03";"Fornecedores-Operacoes com Partes  Relacionadas-No Pais-Circulante";"Contas que registram o valor a pagar correspondentes a compra de bens, direitos e servicos de fornecedores nacionais, relacionados com declarante, conforme conceito definido no CPC 05(R1), itens 09 a 12"
"2.01.01.03.04";"Fornecedores-Operacoes com Partes Relacionadas-No Exterior-Circulante";"Contas que registram o valor a pagar correspondentes a compra de bens, direitos e servicos de fornecedores estrangeiros, relacionados com declarante, conforme conceito definido no CPC 05(R1), itens 09 a 12"
"2.01.01.03.50";"(-) Juros a Apropriar Decorrentes de Ajuste a Valor Presente (AVP)-Fornecedores Circulante";"Contas que registram os valores dos juros a serem apropriados como despesa financeira decorrente do ajuste a valor presente efetuados nos instrumentos de dividas vinculados a compras efetuadas a prazo. Referidos valores serao apropriados ao resultado pelo regime de competencia e adicionados ao Lucro Real(art. 38, ?2o, Instrucao Normativa SRF no 1.515/2014). Em sendo as contrapartidas registradas em subcontas vinculadas aos ativos adquiridos, poderao ser excluidas no periodo em que os ativos forem realizados, nos termos do art. 37, Instrucao Normativa SRF no 1.515/2014."
"2.01.01.03.90";"Subconta-Adocao Inicial-Fornecedores-Circulante";"Contas que registram as diferencas positivas ou negativas, na data da adocao dos efeitos da Lei no 12.973/2014, entre o valor do passivo mensurado de acordo as disposicoes da Lei no 6.404/1976 e o valor mensurado pelos metodos e criterios vigentes em 31/12/2007(arts. 66/67, Lei no 12.973/2014). Referidos valores  deverao ser computados na apuracao  Lucro Real a medida que o passivo for baixado ou liquidado (arts. 165 e 168,  Instrucao Normativa SRF no 1.515/2014, cujos detalhes sobre a contabilizacao estao descritos em seu Anexo I,  exemplos 1/2) Conforme disciplinado art. 169, ? 9a, Instrucao Normativa SRF no 1.515/2014, cada subconta de adocao inicial deve registrar individualmente a diferenca de valor identificada em cada ativo.  Apenas no caso da conta contabil que registra o passivo consolidar varios itens de mesma natureza, pode-se  utilizar uma mesma subconta coletiva, desde que demonstre-os em razao auxiliar vinculado a ECD(art. 169, ?6o, Instrucao Normativa SRF no 1.515/2014)"
"2.01.01.05";"CONTAS A PAGAR-CIRCULANTE";
"2.01.01.05.01";"Adiantamentos de Clientes-no Pais";"Contas que registram o valor correspondente a adiantamentos de clientes no pais."
"2.01.01.05.02";"Adiantamentos de Clientes-no Exterior";"Contas que registram o valor correspondente a adiantamentos de clientes no exterior."
"2.01.01.05.50";"(-) Juros a Apropriar Decorrentes de Ajuste a Valor Presente (AVP)- Contas a Pagar-Circulante";"Contas que registram os valores dos juros a serem apropriados como despesa financeira decorrente do ajuste a valor presente efetuados nos instrumentos de dividas vinculados a adiantamentos de clientes. Referidos valores serao apropriados ao resultado pelo regime de competencia e adicionados ao Lucro Real(art. 38, ?2o, Instrucao Normativa SRF no 1.515/2014). Em sendo as contrapartidas registradas em subcontas vinculadas a ativos adquiridos, poderao ser excluidas no periodo em que os ativos forem realizados, nos termos do art. 37, Instrucao Normativa SRF no 1.515/2014."
"2.01.01.05.90";"Subconta-Adocao Inicial-Contas a Pagar-Circulante";"Contas que registram as diferencas positivas ou negativas, na data da adocao dos efeitos da Lei no 12.973/2014, entre o valor do passivo mensurado de acordo as disposicoes da Lei no 6.404/1976 e o valor mensurado pelos metodos e criterios vigentes em 31/12/2007(arts. 66/67, Lei no 12.973/2014). Referidos valores  deverao ser computados na apuracao  Lucro Real a medida que o passivo for baixado ou liquidado (arts. 165 e 168,  Instrucao Normativa SRF no 1.515/2014, cujos detalhes sobre a contabilizacao estao descritos em seu Anexo I,  exemplos 1/2). Conforme disciplinado art. 169, ? 9a, Instrucao Normativa SRF no 1.515/2014, cada subconta de adocao inicial deve registrar individualmente a diferenca de valor identificada em cada ativo.  Apenas no caso da conta contabil que registra o passivo consolidar varios itens de mesma natureza, pode-se  utilizar uma mesma subconta coletiva, desde que demonstre-os em razao auxiliar vinculado a ECD(art. 169, ?6o, Instrucao Normativa SRF no 1.515/2014)"
"2.01.01.07";"EMPRESTIMOS OU FINANCIAMENTOS-CIRCULANTE";
"2.01.01.07.01";"Duplicatas Descontadas-Circulante";"Contas que registram o valor das parcelas a serem subtraidas do circulante, correspondentes a valores das duplicatas descontadas que retificam o grupo de clientes. Ainda que represente uma divida, caso a pessoa juridica registre esta conta no ativo, deve ser classificada neste referencial junto com a conta que retifique na contabilidade societaria."
"2.01.01.07.02";"Emprestimos ou Financiamentos-no Pais-Circulante";"Contas que registram o valor dos financiamentos e emprestimos a curto prazo, obtidos com instituicao financeira no Brasil. Encargos financeiros a transcorrer e juros a pagar decorrentes devem ser classificadas nesta conta. As obrigacoes por emprestimos tomados  com pessoa juridica nao financeira e fisica deverao ser informados na conta de mutuos."
"2.01.01.07.03";"Emprestimos ou Financiamentos-no Exterior-Circulante";"Contas que registram o valor dos financiamentos e emprestimos a curto prazo, obtidos com instituicao financeira no Exterior. Encargos financeiros a transcorrer e juros a pagar decorrentes devem ser classificadas  nesta conta.As obrigacoes por emprestimos tomados  com pessoa juridica nao financeira e fisica deverao ser informados na conta de mutuos."
"2.01.01.07.04";"Adiantamentos de Contrato de Cambio-Circulante";"Contas que registram o valor das obrigacoes de curto prazo relativas as operacoes de credito na modalidade de adiantamento de contrato de cambio."
"2.01.01.07.05";"Arrendamento Mercantil-no Pais-Circulante";"Contas que registram o valor das obrigacoes de curto prazo relativas a arrendamento mercantil contratados no pais."
"2.01.01.07.06";"Arrendamento Mercantil-no Exterior-Circulante";"Contas que registram o valor das obrigacoes de curto prazo relativas a arrendamento mercantil contratados no exterior."
"2.01.01.07.50";"(-) Juros a Apropriar Decorrent. de Ajuste a Valor Presente(AVP)- Emprestimos e Financia.-Circulante";"Contas que registram os valores dos juros a serem apropriados como despesa financeira decorrente do ajuste a valor presente efetuados nos instrumentos de dividas vinculados a emprestimos e financiamentos. Referidos valores serao apropriados ao resultado pelo regime de competencia e adicionados ao Lucro Real(art. 38, ?2o, Instrucao Normativa SRF no 1.515/2014). Exceto para as operacoes de leasing financeiro(art. 89, Instrucao Normativa SRF no 1.515/2014) em sendo as contrapartidas registradas em subcontas vinculadas aos ativos adquiridos, poderao ser excluidas no periodo em que os ativos forem realizados, nos termos do art. 37, Instrucao Normativa SRF no 1.515/2014."
"2.01.01.07.90";"Subconta-Adocao Inicial-Emprestimos e Financiamentos-Circulante";"Contas que registram as diferencas positivas ou negativas, na data da adocao dos efeitos da Lei no 12.973/2014, entre o valor do passivo mensurado de acordo as disposicoes da Lei no 6.404/1976 e o valor mensurado pelos metodos e criterios vigentes em 31/12/2007(arts. 66/67, Lei no 12.973/2014). Referidos valores  deverao ser computados na apuracao  Lucro Real a medida que o passivo for baixado ou liquidado (arts. 165 e 168,  Instrucao Normativa SRF no 1.515/2014, cujos detalhes sobre a contabilizacao estao descritos em seu Anexo I,  exemplos 1/2). Conforme disciplinado art. 169, ? 9a, Instrucao Normativa SRF no 1.515/2014, cada subconta de adocao inicial deve registrar individualmente a diferenca de valor identificada em cada ativo.  Apenas no caso da conta contabil que registra o passivo consolidar varios itens de mesma natureza, pode-se  utilizar uma mesma subconta coletiva, desde que demonstre-os em razao auxiliar vinculado a ECD(art. 169, ?6o, Instrucao Normativa SRF no 1.515/2014)"
"2.01.01.09";"OBRIGACOES FISCAIS-CIRCULANTE";
"2.01.01.09.01";"IRRF a Recolher-Circulante";"Contas que registram o valor referentes ao IRRF a Recolher no final do periodo de apuracao."
"2.01.01.09.02";"IPI a Recolher-Circulante";"Contas que registram o valor referentes ao IPI a Recolher no final do periodo de apuracao."
"2.01.01.09.03";"ICMS a Recolher-Circulante";"Contas que registram o valor referente ao ICMS a Recolher no final do periodo de apuracao."
"2.01.01.09.04";"PIS a Recolher-Circulante";"Contas que registram o valor do PIS a recolher."
"2.01.01.09.05";"COFINS a Recolher-Circulante";"Contas que registram o valor da COFINS a recolher."
"2.01.01.09.06";"IOF a Recolher-Circulante";"Contas que registram o valor do IOF a recolher."
"2.01.01.09.07";"CIDE a Recolher-Circulante";"Contas que registram o valor da CIDE a recolher."
"2.01.01.09.08";"Tributos Municipais a Recolher-Circulante";"Contas que registram o valor dos tributos municipais a Recolher no final do periodo de apuracao."
"2.01.01.09.09";"Parcelamentos Especiais a Recolher-Tributos Federais-Circulante";"Contas que registram o valor dos saldos de parcelamentos especiais e ordinarios de tributos federais a Recolher no final do periodo de apuracao."
"2.01.01.09.10";"Parcelamentos Especiais a Recolher-Tributos Estaduais e Municipais-Circulante";"Contas que registram o valor dos saldos de parcelamentos especiais e ordinarios de tributos estaduais e municipais a recolher no final do periodo de apuracao."
"2.01.01.09.11";"Contribuicoes Previdenciarias a Recolher-Desoneracao da Folha de Pagamento -Circulante";"Contas que registram o valor referente a contribuicao sobre o faturamento em substituicao ao INSS sobre a folha. Informar o saldo a recolher no final do periodo de apuracao."
"2.01.01.09.12";"Tributos Retidos a Recolher -Circulante";"Contas que registram o valor referente aos tributos retidos a recolher. Informar o saldo a recolher no final do periodo de apuracao."
"2.01.01.09.13";"IRPJ a Recolher -Circulante";"Contas que registram o valor referente ao IRPJ a recolher. Informar o saldo a recolher no final do periodo de apuracao."
"2.01.01.09.14";"CSLL a Recolher -Circulante";"Contas que registram o valor referente a CSLL a recolher. Informar o saldo a recolher no final do periodo de apuracao."
"2.01.01.09.28";"Outros Tributos a Recolher-Circulante";"Contas que registram o valor dos tributos a recolher nao classificaveis em contas especificas."
"2.01.01.11";"VALORES MOBILIARIOS -HEDGE-NO PAIS";
"2.01.01.11.01";"Derivativos-Hedge Valor Justo-No Pais";"Contas que registram os instrumentos destinados a  hedge de valor justo operados em ambiente negocial no pais. Toda documentacao exigida para operar em 'Hedge Accounting' deve constar em Nota Explicativa encaminhada pela ECD. "
"2.01.01.11.02";"Derivativos-Hedge Fluxo de Caixa-No Pais";"Contas que registram os instrumentos destinados a  hedge de fluxo de caixa operados em ambiente negocial no pais. Toda documentacao exigida para operar em 'Hedge Accounting' deve constar em Nota Explicativa encaminhada pela ECD."
"2.01.01.11.03";"Derivativos-Hedge  Investimento no Exterior-No Pais";"Contas que registram os instrumentos destinados a  hedge de fluxo de investimento no exterior operados em ambiente negocial no pais. Toda documentacao exigida para operar em 'Hedge Accounting' deve constar em Nota Explicativa encaminhada pela ECD."
"2.01.01.11.70";"Subconta-Ajuste a Valor Justo-Valores Mobiliarios-Hedge-No Pais";"Contas que registram os ajustes a valor justo positivos ou negativos efetuados sobre os passivos financeiros, inclusive decorrentes apenas de sua mensuracao inicial. Referidos valores  deverao ser computados na apuracao  Lucro Real quando da baixa ou liquidacao do passivo(arts. 49/53,  Instrucao Normativa SRF no 1.515/2014, cujos detalhes sobre a contabilizacao estao descritos em seu Anexo I,  exemplos 5/6). Apenas no caso da conta contabil que registra o ativo consolidar varios itens de mesma natureza, pode-se  utilizar uma mesma subconta coletiva, desde que demonstre-os em razao auxiliar vinculado a ECD(art. 33, ?3o, Instrucao Normativa SRF no 1.515/2014)"
"2.01.01.11.90";"Subconta-Adocao Inicial-Valores Mobiliarios-Hedge-No Pais";"Contas que registram as diferencas positivas ou negativas, na data da adocao dos efeitos da Lei no 12.973/2014, entre o valor do passivo mensurado de acordo as disposicoes da Lei no 6.404/1976 e o valor mensurado pelos metodos e criterios vigentes em 31/12/2007(arts. 66/67, Lei no 12.973/2014). Referidos valores  deverao ser computados na apuracao  Lucro Real a medida que o passivo for baixado ou liquidado (arts. 165 e 168,  Instrucao Normativa SRF no 1.515/2014, cujos detalhes sobre a contabilizacao estao descritos em seu Anexo I,  exemplos 1/2). Conforme disciplinado art. 169, ? 9a, Instrucao Normativa SRF no 1.515/2014, cada subconta de adocao inicial deve registrar individualmente a diferenca de valor identificada em cada ativo.  Apenas no caso da conta contabil que registra o passivo consolidar varios itens de mesma natureza, pode-se  utilizar uma mesma subconta coletiva, desde que demonstre-os em razao auxiliar vinculado a ECD(art. 169, ?6o, Instrucao Normativa SRF no 1.515/2014)"
"2.01.01.12";"VALORES MOBILIARIOS -HEDGE-NO EXTERIOR";
"2.01.01.12.01";"Derivativos-Hedge Valor Justo-No Exterior";"Contas que registram os instrumentos destinados a  hedge de valor justo operados em ambiente negocial no exterior. Toda documentacao exigida para operar em 'Hedge Accounting' deve constar em Nota Explicativa encaminhada pela ECD. "
"2.01.01.12.02";"Derivativos-Hedge Fluxo de Caixa-No Exterior";"Contas que registram os instrumentos destinados a  hedge de fluxo de caixa operados em ambiente negocial no exterior. Toda documentacao exigida para operar em 'Hedge Accounting' deve constar em Nota Explicativa encaminhada pela ECD."
"2.01.01.12.03";"Derivativos-Hedge  Investimento no Exterior-No Exterior";"Contas que registram os instrumentos destinados a  hedge de fluxo de investimento no exterior operados em ambiente negocial no exterior. Toda documentacao exigida para operar em 'Hedge Accounting' deve constar em Nota Explicativa encaminhada pela ECD."
