"CONTA_CONTABIL";"DESCRICAO";"ORIENTACOES"
"3.01.01.01.02.01";"(-) Vendas Canceladas e Devolucoes de Vendas";"Contas que registram o valor que correspondam as vendas canceladas e a devolucoes de vendas."
"3.01.01.01.02.02";"(-) Descontos Incondicionais e Abatimentos";"Contas que registram o valor que corresponde a descontos incondicionais e abatimentos concedidos."
"3.01.01.01.02.03";"(-) ICMS";"Contas que registram o total do Imposto Sobre Operacoes Relativas a Circulacao de Mercadorias e Sobre Prestacao de Servicos de Transporte Interestadual e Intermunicipal e de Comunicacao (ICMS) calculado sobre as receitas das vendas e de servicos.  Informar o resultado da aplicacao das aliquotas sobre as respectivas receitas, e nao o montante recolhido, durante o periodo de apuracao, pela pessoa juridica.  O valor referente ao ICMS pago como substituto nao deve ser incluido nesta conta."
"3.01.01.01.02.04";"(-) COFINS Sobre Receita Bruta";"Contas que registram o valor total da COFINS apurada sobre a receita de vendas em consonancia com a legislacao vigente a epoca da ocorrencia dos fatos geradores. O valor informado deve ser apurado de forma centralizada pelo estabelecimento matriz, quando a pessoa juridica possuir mais de um estabelecimento (Lei no 9.779, de 1999, art. 15, III).  Nao incluir a COFINS incidente sobre as demais receitas operacionais, que devera ser informada em conta distinta."
"3.01.01.01.02.05";"(-) PIS/PASEP Sobre Receita Bruta";"Contas que registram o valor total das contribuicoes para o PIS/PASEP apurado sobre a receita de vendas em consonancia com a legislacao vigente a epoca da ocorrencia dos fatos geradores. O valor informado deve ser apurado de forma centralizada pelo estabelecimento matriz, quando a pessoa juridica possuir mais de um estabelecimento (Lei no 9.779, de 1999, art. 15, III). Nao incluir a COFINS incidente sobre as demais receitas operacionais, que devera ser informada em conta distinta."
"3.01.01.01.02.06";"(-) ISS";"Contas que registram o Imposto sobre Servico de qualquer Natureza (ISS) relativo as receitas de servicos, conforme legislacao especifica."
"3.01.01.01.02.09";"(-) Demais Impostos e Contribuicoes Incidentes sobre Vendas e Servicos";"Contas que registrem os demais impostos e contribuicoes incidentes sobre as receitas das vendas de que tratam as contas integrantes do grupo RECEITA BRUTA, que guardem proporcionalidade com o preco e sejam considerados redutores das receitas de vendas."
"3.01.01.01.02.10";"(-) Ajuste a Valor Presente sobre Receita Bruta";"Contas que registram os expurgos dos efeitos do ajuste a valor presente sobre a receita bruta."
"3.01.01.03";"CUSTO DOS BENS E SERVICOS";
"3.01.01.03.01";"CUSTO DOS BENS E SERVICOS VENDIDOS DAS ATIVIDADES EM GERAL";
"3.01.01.03.01.01";"(-) Custo dos Produtos de Fabricacao Propria Vendidos";"Contas que registram o valor dos gastos que compoem o custo total de producao propria apos a realizacao dos estoques. "
"3.01.01.03.01.02";"(-) Custo das Mercadorias Revendidas";"Contas que registram o valor dos gastos que compoem o custo total das mercadorias revendidas apos a realizacao dos estoques. "
"3.01.01.03.01.03";"(-) Custo dos Servicos Prestados";"Contas que registram o valor dos gastos que compoem o custo total da prestacao de servico."
"3.01.01.03.01.04";"(-) Custo das Unidades Imobiliarias Vendidas";"Contas que registram o valor dos gastos que compoem o custo total das unidades imobiliarias vendidas."
"3.01.01.03.01.20";"(-) Custo de Construcao";"Contas que registram o valor dos custos de contratos de construcao"
"3.01.01.03.01.30";"(-) Custo de Operacao de Securitizacao";"Contas que registram o valor dos custos derivados da operacao de securitizacao"
"3.01.01.05";"OUTRAS RECEITAS OPERACIONAIS";
"3.01.01.05.01";"OUTRAS RECEITAS OPERACIONAIS DAS ATIVIDADES EM GERAL";
"3.01.01.05.01.01";"Variacoes Cambiais Ativas";"Contas que registram os ganhos apurados em razao de variacoes ativas decorrentes da atualizacao dos direitos de credito e obrigacoes, calculados com base nas variacoes nas taxas de cambio."
"3.01.01.05.01.02";"Ganhos Auferidos no Mercado de Renda Variavel, exceto Day-Trade";"Contas que registram: a) o somatorio dos ganhos auferidos, em cada mes do periodo de apuracao, em operacoes realizadas nas bolsas de valores, de mercadorias, de futuros e assemelhadas, existentes no Pais; Atencao: 1) Os ganhos auferidos em operacoes day-trade devem ser informados em conta especifica. 2) O valor correspondente as perdas incorridas no mercado de renda variavel, exceto day-trade, deve ser informado em conta especifica. 3) Sao consideradas assemelhadas as bolsas de valores, de mercadorias e de futuros as entidades cujo objeto social seja analogo ao das referidas bolsas e que funcionem sob a supervisao e fiscalizacao da Comissao de Valores Mobiliarios (CVM)."
"3.01.01.05.01.03";"Ganhos em Operacoes Day-Trade";"Contas que registram os ganhos diarios auferidos, em cada mes do periodo de apuracao, em operacoes day-trade.  Considera-se ganho o resultado positivo auferido nas operacoes citadas acima, realizadas em cada mes, admitida a deducao dos custos e despesas incorridos, necessarios a realizacao das operacoes.  Nao se caracteriza como day-trade o exercicio da opcao e a venda ou compra do ativo no mercado a vista, no mesmo dia.  Tambem nao se caracterizam como day-trade as operacoes iniciadas por intermedio de uma instituicao e encerradas em outra, quando houver a liquidacao fisica mediante movimentacao de titulos ou valores mobiliarios em custodia."
"3.01.01.05.01.04";"Receitas de Juros sobre o Capital Proprio";"Contas que registram os juros recebidos, a titulo de remuneracao do capital proprio, em conformidade com o art. 9o da Lei no 9.249, de 1995. O valor informado deve corresponder ao total dos juros recebidos antes do desconto do imposto de renda na fonte. O valor do imposto de renda retido na fonte, para as pessoas juridicas tributadas pelo lucro real, e considerado antecipacao do imposto devido no encerramento do periodo de apuracao ou, ainda, pode ser compensado com aquele que for retido, pela beneficiaria, por ocasiao do pagamento ou credito de juros a titulo de remuneracao do capital proprio, ao seu titular ou aos seus socios. "
"3.01.01.05.01.05";"Outras Receitas Financeiras";"Contas que registram receitas auferidas no periodo de apuracao relativas a juros, descontos, lucro na operacao de reporte, premio de resgate de titulos ou debentures e rendimento nominal auferido em aplicacoes financeiras de renda fixa, nao incluidas em linhas especificas. As receitas dessa natureza, derivadas de operacoes com titulos venciveis apos o encerramento do periodo de apuracao, serao rateadas segundo o regime de competencia."
"3.01.01.05.01.06";"Resultados Positivos em Participacoes Societarias Avaliadas pelo Metodo de Equivalencia Patrimonial";"Contas que registram o ganho de investimento avaliado pelo metodo da equivalencia patrimonial."
"3.01.01.05.01.07";"Resultados Positivos em SCP Avaliadas pelo Metodo de Equivalencia Patrimonial";"Esta conta e utilizada pelas pessoas juridicas que forem socias ostensivas de sociedades em conta de participacao, para a indicacao: a) de lucros derivados de participacao em SCP, avaliadas pelo custo de aquisicao; b) dos ganhos por ajustes no valor de participacao em SCP, avaliadas pelo metodo da equivalencia patrimonial. Os lucros recebidos de investimento em SCP, avaliado pelo custo de aquisicao, ou a contrapartida do ajuste do investimento ao valor do patrimonio liquido da SCP, no caso de investimento avaliado por esse metodo, podem ser excluidos na determinacao do lucro real dos socios, pessoas juridicas, das referidas sociedades (Decreto no 3.000, de 1999, art. 149)."
"3.01.01.05.01.08";"Rendimentos e Ganhos de Capital Auferidos no Exterior";"Contas que registram os rendimentos e ganhos de capital auferidos no exterior diretamente pela pessoa juridica domiciliada no Brasil, pelos seus valores antes de descontado o tributo pago no pais de origem. Esses valores podem, no caso de apuracao trimestral do imposto, ser excluidos na apuracao do lucro real do 1o aos 3o trimestres, devendo ser adicionados ao lucro liquido na apuracao do lucro real referente ao 4o trimestre. Atencao: Os ganhos de capital referentes a alienacoes de bens e direitos do ativo nao-circulante, exceto os classificaveis no ativo realizavel a longo prazo, situados no exterior devem ser informados em outras receitas."
"3.01.01.05.01.09";"Reversao das Perdas Estimadas Decorrentes de Teste de Recuperabilidade (Impairment)";" Contas que registram o ganho decorrente da reversao das perdas estimadas decorrentes da aplicacao de teste de recuperabilidade sobre os ativos. "
"3.01.01.05.01.10";"Reversao dos Saldos das Provisoes";"Contas que registram a reversao dos saldos nao utilizados das provisoes constituidas no balanco do periodo de apuracao imediatamente anterior e ou constituida no proprio periodo de apuracao para fins de apuracao do lucro real."
"3.01.01.05.01.11";"Premios Recebidos na Emissao de Debentures";"Contas que registram valor dos premios recebidos na emissao de debentures, tais como:                                                                                            1) A pessoa juridica podera excluir o valor decorrente de premios recebidos na emissao de debentures, reconhecido no exercicio, para fins de apuracao do lucro real; caso mantenha em reserva de lucros especifica a parcela decorrente de premio na emissao de debentures, apurada ate o limite do lucro liquido do exercicio;  2) O premio na emissao de debentures sera tributado caso seja dada destinacao diversa da que esta prevista no item 1 acima, inclusive nas hipoteses de: a) capitalizacao do valor e posterior restituicao de capital aos socios ou ao titular, mediante reducao do capital social, hipotese em que a base para a incidencia sera o valor restituido, limitado ao valor total das exclusoes decorrentes de premios na emissao de debentures; b) restituicao de capital aos socios ou ao titular, mediante reducao do capital social, nos 5 (cinco) anos anteriores a data da emissao das debentures com o premio, com posterior capitalizacao do valor do premio, hipotese em que a base para a incidencia sera o valor restituido, limitado ao valor total das exclusoes decorrentes de premios na emissao de debentures; ou c) integracao a base de calculo dos dividendos obrigatorios."
"3.01.01.05.01.12";"Doacoes e Subvencoes para Custeio ou Operacoes";"Contas que registram as subvencoes para custeio ou operacoes recebidas, inclusive mediante isencao ou reducao de impostos concedidas como estimulo a implantacao ou expansao de empreendimentos economicos, e as doacoes recebidas do Poder Publico."
"3.01.01.05.01.13";"Doacoes e Subvencoes para Investimentos";"Contas que registras as subvencoes para investimento recebidas, inclusive mediante isencao ou reducao de impostos concedidas como estimulo a implantacao ou expansao de empreendimentos economicos, e as doacoes recebidas do Poder Publico. Atencao: 1) A pessoa juridica podera excluir o valor decorrente de doacoes ou subvencoes governamentais para investimentos, reconhecido no exercicio, para fins de apuracao do lucro real; caso mantenha em reserva de lucros a que se refere o art. 195-A da Lei no 6.404, de 1976, a parcela decorrente de doacoes ou subvencoes governamentais, apurada ate o limite do lucro liquido do exercicio. 2) As doacoes e subvencoes serao tributadas caso seja dada destinacao diversa da prevista no item 1, inclusive nas hipoteses de:  a) capitalizacao do valor e posterior restituicao de capital aos socios ou ao titular, mediante reducao do capital social, hipotese em que a base para a incidencia sera o valor restituido, limitado ao valor total das exclusoes decorrentes de doacoes ou subvencoes governamentais para investimentos;  b) restituicao de capital aos socios ou ao titular, mediante reducao do capital social, nos 5 (cinco) anos anteriores a data da doacao ou da subvencao, com posterior capitalizacao do valor da doacao ou da subvencao, hipotese em que a base para a incidencia sera o valor restituido, limitado ao valor total das exclusoes decorrentes de doacoes ou de subvencoes governamentais para investimentos; ou  c) integracao a base de calculo dos dividendos obrigatorios.  3) Se, no periodo base em que ocorrer a exclusao, a pessoa juridica apurar prejuizo contabil ou lucro liquido contabil inferior a parcela decorrente de doacoes e subvencoes governamentais, e neste caso nao puder ser constituida como parcela de lucros nos termos do item 1 acima, esta devera ocorrer nos exercicios subsequentes."
"3.01.01.05.01.14";"Receitas de Reclassificacao de Ajustes de Avaliacao Patrimonial";"Contas que registram as contrapartidas da realizacao do grupo Ajustes de Avaliacao Patrimonial do PL reconhecidas no resultado do exercicio em obediencia ao regime de competencia."
"3.01.01.05.01.15";"Receitas de Reclassificacao de Ajustes de Avaliacao Patrimonial-Reflexo";"Contas que registram as contrapartidas da realizacao do grupo Ajustes de Avaliacao Patrimonial do PL-Reflexo reconhecidas no resultado do exercicio em obediencia ao regime de competencia."
"3.01.01.05.01.16";"Receitas Financeiras Decorrentes de Ajustes ao Valor Presente";"Contas que registram as contrapartidas de aumentos de ativos sujeitos a Ajuste ao Valor Presente de acordo com o regime de competencia."
"3.01.01.05.01.17";"Ganho Por Compra Vantajosa em Investimentos";"Contas que registram os ganhos auferidos por compra vantajosa nas aquisicoes de controle de investimento, independente do criterio de avaliacao."
"3.01.01.05.01.18";"Amortizacao de Menos-Valia";"Contas que registram a amortizacao de menos-valia."
"3.01.01.05.01.19";"Receita de Aluguel de Bens Imoveis-Atividade Nao Principal";"Contas que registram alugueis de bens por empresa que nao tenha por objeto a locacao de imoveis."
"3.01.01.05.01.20";"Receita de Aluguel de Bens Moveis-Atividade Nao Principal";"Contas que registram alugueis de bens por empresa que nao tenha por objeto a locacao de moveis."
"3.01.01.05.01.21";"Creditos Presumidos de IPI";"Contas que registram os creditos presumidos do IPI para ressarcimento do valor da Contribuicao ao PIS/PASEP e COFINS."
"3.01.01.05.01.22";"Creditos Presumidos de PIS/COFINS";"Contas que registram o credito presumido da contribuicao para o PIS/PASEP e da COFINS concedido na forma do art. 3o da Lei no 10.147, de 2000."
"3.01.01.05.01.23";"Outros Creditos Fiscais Presumidos";"Contas que registram outros creditos fiscais presumidos."
"3.01.01.05.01.24";"Multas e Outras Vantagens Recebidas";"Contas que registram multas ou vantagens a titulo de indenizacao em virtude de rescisao contratual (Lei no 9.430, de 1996, art. 70, ? 3o, II)."
"3.01.01.05.01.25";"Lucros e Dividendos Derivados de Participacoes Societarias Avaliadas pelo Custos de Aquisicao";"Contas que registram os resultados positivos em participacoes societarias avaliadas pelo custo de aquisicao."
"3.01.01.05.01.26";"Receitas com Emprestimos de Valores Mobiliarios";"Contas que registram as receitas com emprestimos de valores mobiliarios."
"3.01.01.05.01.27";"Rendimentos Auferidos em Operacoes de Mutuo-Partes Relacionadas";"Contas que registram os juros auferidos em operacoes de mutuo com partes relacionadas com a declarante, conforme conceito definido no CPC 05(R1), itens 09 a 12."
"3.01.01.05.01.28";"Rendimentos Auferidos em Operacoes de Mutuo-Partes Nao Relacionadas";"Contas que registram os juros auferidos em operacoes de mutuo com partes nao relacionadas com a declarante, conforme conceito definido no CPC 05(R1), itens 09 a 12."
"3.01.01.05.01.29";"Rendimentos Auferidos com Debentures-Emitente Partes  Relacionadas";"Contas que registram os juros auferidos com debentures emitidas por partes relacionadas."
"3.01.01.05.01.30";"Rendimentos Auferidos com Debentures-Emitente Partes Nao Relacionadas";"Contas que registram os juros auferidos com debentures emitidas por partes nao relacionadas."
"3.01.01.05.01.31";"Rendimentos Auferidos com Titulos Publicos";"Contas que registram os juros auferidos em certificados de depositos bancarios (CDB)."
"3.01.01.05.01.32";"Juros Auferidos com Outros Ativos Financeiros Mensurados Pelo Custo Amortizado";"Contas que registram os juros auferidos com outros ativos financeiros mensurados pelo custo amortizado."
"3.01.01.05.01.33";"Ganho de Ajustes a Valor Justo-Instrumentos Financeiros  para Negociacao-Nao Hedge-VJPR.";"Contas que registram os ganhos decorrentes de ajustes a valor justo de instrumentos financeiros para negociacao, exceto hedge, avaliados a valor justo pelo resultado."
"3.01.01.05.01.34";"Ganho de Ajustes Valor Justo -Instru. Financ.  Disp. p/Venda-Reclas. de Ajustes de Avaliacao Patrim.";"Contas que registram os ganhos decorrentes de ajustes a valor justo de instrumentos financeiros disponiveis para venda no momento da reclassificacao dos ajustes de avaliacao patrimonial."
"3.01.01.05.01.35";"Ganho de Ajustes a Valor Justo-Instrumentos Financeiros  de Hedge  de Valor Justo";"Contas que registram os ganhos decorrentes de ajustes a valor justo de instrumentos financeiros de hedge."
"3.01.01.05.01.36";"Ganho de Ajustes a Valor Justo-Instru. Financ.  de Hedge-Reclassif. de Ajustes de Avaliacao Patrim.";"Contas que registram os ganhos decorrentes de ajustes a valor justo de instrumentos financeiros de hedge no momento da reclassificacao dos ajustes de avaliacao patrimonial."
"3.01.01.05.01.37";"Ganho de Ajustes a Valor Justo-Item Objeto de Hedge de Valor Justo";"Contas que registram os ganhos decorrentes de ajustes a valor justo de item objeto de hedge."
"3.01.01.05.01.38";"Ganho de Ajustes a Valor Justo-Propriedade para Investimento";"Contas que registram os ganhos decorrentes de ajustes a valor justo de propriedades para investimento."
"3.01.01.05.01.39";"Ganho de Ajustes a Valor Justo-Ativo Biologico Consumivel";"Contas que registram os ganhos decorrentes de ajustes a valor justo de ativo biologico consumivel."
"3.01.01.05.01.40";"Ganho de Ajustes a Valor Justo-Ativo Biologico de Producao";"Contas que registram os ganhos decorrentes de ajustes a valor justo de ativo biologico de producao."
"3.01.01.05.01.41";"Ganho de Ajustes a Valor Justo-Ativos Nao Circulantes Mantidos para Venda";"Contas que registram os ganhos decorrentes de ajustes a valor justo de ativos nao circulantes mantidos para venda."
"3.01.01.05.01.42";"Ganho de Ajustes a Valor Justo-Subscricao de Capital com demais Bens";"Contas que registram os ganhos decorrentes de ajustes a valor justo de subscricao de capital com demais bens."
"3.01.01.05.01.43";"Ganho de Ajustes a Valor Justo-Subscricao de Capital com Participacao Societaria";"Contas que registram os ganhos decorrentes de ajustes a valor justo de subscricao de capital com participacao societaria."
"3.01.01.05.01.44";"Ganho de Ajustes a Valor Justo-Aquisicao de Participacao Societaria em Estagios";"Contas que registram os ganhos decorrentes de ajustes a valor justo de aquisicao de participacao societaria em estagios."
"3.01.01.05.01.45";"Ganho de Ajustes a Valor Justo - Decorrente de Permuta de Ativos ou Passivos";"Contas que registram os ganhos decorrentes de ajustes a valor justo devido a permuta de ativos ou passivos."
"3.01.01.05.01.46";"Ganho de Ajustes a Valor Justo - Outras Operacoes";"Contas que registram os ganhos decorrentes de ajustes a valor justo de outras operacoes nao classificaveis neste plano de contas."
"3.01.01.05.01.47";"Receitas Provenientes de Partes Relacionadas";"Contas que registram as receitas provenientes de partes relacionadas."
"3.01.01.05.01.48";"Receitas Provenientes de Partes Nao Relacionadas";"Contas que registram as receitas provenientes de partes relacionadas."
"3.01.01.05.01.99";"Outras Receitas Operacionais";"Contas que registrem as demais receitas que, por definicao legal, sejam consideradas operacionais. tais como recuperacoes de despesas operacionais de periodos de apuracao anteriores, tais como: premios de seguros, importancias levantadas das contas vinculadas do FGTS, ressarcimento de desfalques, roubos e furtos, etc. As recuperacoes de custos e despesas no decurso do proprio periodo de apuracao devem ser creditadas diretamente as contas de resultado em que foram debitadas."
"3.01.01.07";"DESPESAS OPERACIONAIS";
"3.01.01.07.01";"DESPESAS OPERACIONAIS DAS ATIVIDADES EM GERAL";
"3.01.01.07.01.01";"(-) Remuneracao a Dirigentes e a Conselho de Administracao";"Contas que registram a despesa incorrida relativa a remuneracao mensal e fixa atribuida ao titular de firma individual, aos socios, diretores e administradores de sociedades, ou aos representantes legais de sociedades estrangeiras, as despesas incorridas com os salarios indiretos concedidos pela empresa a administradores, diretores, gerentes e seus assessores (PN Cosit no 11, de 1992), e o valor referente as remuneracoes atribuidas aos membros do conselho fiscal ou consultivo. Atencao: 1) Os valores das gratificacoes aos dirigentes que estejam ligados a area industrial ou de producao de servicos devem ser informados nas contas de custos, respectivamente; 2) O valor de 13o salario pago a diretor contratado nos termos da Consolidacao das Leis do Trabalho (CLT) e dedutivel, desde que ele nao esteja enquadrado no conceito de socio, diretor ou administrador estabelecido no PN CST no 48, de 1972.                                                                                                                                                                                                                                                                                                       3) As gratificacoes espontaneas devem ser adicionadas ao Lucro Real."
"3.01.01.07.01.02";"(-) Ordenados, Salarios, Gratificacoes e Outras Remuneracoes a Empregados";"Contas que registram as despesas com ordenados, salarios, gratificacoes e outras despesas com empregados, tais como: comissoes, moradia, seguro de vida, contribuicoes pagas ao plano PAIT, despesas com programa de previdencia privada, contribuicoes para os Fundos de Aposentadoria Programada Individual (Fali), e outras de carater remuneratorio. Atencao: 1) As despesas correspondentes a salarios, ordenados, gratificacoes e outras remuneracoes referentes a area de saude, tais como assistencia medica, odontologica e farmaceutica, devem ser indicadas na conta 'Assistencia, medica, odontologica e farmaceutica a empregados'. 2) Nao deve ser informado nesta linha o valor referente as participacoes dos empregados no lucro da pessoa juridica. Esse valor deve ser informado na conta 'Participacoes de empregados'. 3) O valor das contribuicoes nao compulsorias, destinadas a custear beneficios complementares assemelhados aos da previdencia social, instituidos em favor dos empregados e dirigentes da pessoa juridica, e para os Fundos de Aposentadoria Programada Individual (Fali) cujo onus seja da pessoa juridica, que exceder, no periodo de apuracao, a vinte por cento do total dos salarios dos empregados e da remuneracao dos dirigentes da empresa, vinculados ao referido plano, deve ser adicionado ao Lucro Real. 4) As demais contribuicoes nao compulsorias, exceto as destinadas a custear seguros e planos de saude, devem ser adicionados ao Lucro Real'. "
"3.01.01.07.01.03";"(-) Outros Gastos com Pessoal";"Contas que registrem os demais gastos com pessoal nao especificados em contas anteriores."
"3.01.01.07.01.04";"(-) Outros Servicos Prestados por Pessoa Fisica ou Juridica";"Contas que registram o valor das despesas correspondentes aos servicos prestados por:                                                                                                                                                                              1) Pessoa fisica: que nao tenha vinculo empregaticio com a pessoa juridica declarante, tais como: comissoes, corretagens, gratificacoes, honorarios, direitos autorais e outras remuneracoes, inclusive as relativas a empreitadas de obras exclusivamente de trabalho e as decorrentes de fretes e carretos em geral.                                                                                           2) Pessoa juridica inclusive cooperativa de trabalho e locacao de mao de obra; Atencao: Somente sao dedutiveis as despesas de comissoes e corretagens quando, sobre elas, o credor tenha direito liquido e certo (PN CST no 07, de 28 de janeiro de 1976)."
"3.01.01.07.01.05";"(-) Encargos Sociais-Previdencia Social";"Contas que registram as contribuicoes para a Previdencia Social, nao computadas nos custos (inclusive dos dirigentes-PN CST no 35, de 31 de agosto de 1981)."
"3.01.01.07.01.06";"(-) Encargos Sociais-FGTS";"Contas que registram as contribuicoes para o FGTS nao computadas nos custos (inclusive dos dirigentes-PN CST no 35, de 31 de agosto de 1981)."
"3.01.01.07.01.07";"(-) Encargos Sociais-Outros";"Contas que registram os demais encargos sociais, nao computadas nos custos ou nas contas Encargos Sociais- Previdencia Social ou Encargos Sociais- FGTS."
